place_id,name,description,reviews,rating,website,phone,featured_image,main_category,categories,closed_on,address,link,query,query-02,City,State
ChIJtdiJRxtFE4cRlgDGTH7MB_A,Boulder Street Moto Garage,A private vintage motorcycle club and secret fort for grownups.,20,4.7,https://boulderstreetmoto.com/,,https://lh3.ggpht.com/p/AF1QipONafDNp4EvzaQr3g73Tg0-3VmGGIy9yHHOGXIn=s1024,Motorcycle shop,"Motorcycle shop, Social club",Open All Days,"745 E Pikes Peak Ave Suite #2, Colorado Springs, CO 80903, United States",https://www.google.com/maps/place/Boulder+Street+Moto+Garage/data=!4m7!3m6!1s0x8713451b4789d8b5:0xf007cc7e4cc60096!8m2!3d38.8331984!4d-104.8109278!16s%2Fg%2F11gbl3bgx2!19sChIJtdiJRxtFE4cRlgDGTH7MB_A?authuser=0&hl=en&rclk=1,motorcycle clubs in colorado springs co,colorado springs co,colorado springs,co
ChIJlWJle5tqyWER_mDJbWqxcig,Motorcycle Roadracing Association - MRA,"The MRA (Motorcycle Roadracing Association) is committed to the sport of on-track motorcycle roadracing in Colorado! The MRA features the fastest riders on sport bikes in the state competing head to head on a wide varieties of racing motorcycles. You can experience the excitement of motorcycle racing first hand by attending a racing event, volunteering to be part of the action, or becoming a motorcycle racer.

If you are an aspiring motorcycle road racer, we provide high quality instruction and racing experience opportunities in Colorado. Your own street bike with minimal modifications is an excellent way for aspiring racers to enter the sport under the guidance of friendly, knowledgeable MRA instructors with decades of experience.",2,5,https://www.mra-racing.org/,,https://lh3.ggpht.com/p/AF1QipMGdfBlyeNy9d0z3K5SlAnj4G0RrnJQZGg4Ej5W=s1024,Motoring club,"Motoring club, Service establishment",Open All Days,,https://www.google.com/maps/place/Motorcycle+Roadracing+Association+-+MRA/data=!4m7!3m6!1s0x61c96a9b7b656295:0x2872b16a6dc960fe!8m2!3d38.1689884!4d-104.702355!16s%2Fg%2F11vyfjjdhp!19sChIJlWJle5tqyWER_mDJbWqxcig?authuser=0&hl=en&rclk=1,motorcycle clubs in colorado springs co,colorado springs co,colorado springs,co
ChIJn0rsG71FE4cRcdZiMbrtM_o,"Suns Of Darkness MC, Colorado Springs",,0,0,https://www.facebook.com/sunsofdarknessmc.coloradosprings,,https://streetviewpixels-pa.googleapis.com/v1/thumbnail?panoid=43-VbIa7EzOAA-VuI_3wHg&cb_client=search.gws-prod.gps&w=408&h=240&yaw=185.88628&pitch=0&thumbfov=100,Social club,Social club,Open All Days,"2529 Airport Rd, Colorado Springs, CO 80910, United States","https://www.google.com/maps/place/Suns+Of+Darkness+MC,+Colorado+Springs/data=!4m7!3m6!1s0x871345bd1bec4a9f:0xfa33edba3162d671!8m2!3d38.8250293!4d-104.7824673!16s%2Fg%2F11rmsxt283!19sChIJn0rsG71FE4cRcdZiMbrtM_o?authuser=0&hl=en&rclk=1",motorcycle clubs in colorado springs co,colorado springs co,colorado springs,co
ChIJqyzhUwCjJoYRrYKmFiWMaTE,Steel Fist Riderz MC,,0,0,https://www.facebook.com/steelfist.riderzmc.9?mibextid=ZbWKwL,,https://streetviewpixels-pa.googleapis.com/v1/thumbnail?panoid=jS28IzC6cWtuVsQcwbjzKQ&cb_client=search.gws-prod.gps&w=408&h=240&yaw=234.21191&pitch=0&thumbfov=100,Non-profit organization,Non-profit organization,Open All Days,"9930 Florida Blvd suite g, Baton Rouge, LA 70815, United States",https://www.google.com/maps/place/Steel+Fist+Riderz+MC/data=!4m7!3m6!1s0x8626a30053e12cab:0x31698c2516a682ad!8m2!3d30.4556172!4d-91.0749402!16s%2Fg%2F11vwkbf0kb!19sChIJqyzhUwCjJoYRrYKmFiWMaTE?authuser=0&hl=en&rclk=1,motorcycle clubs in baton rouge la,baton rouge la,baton rouge,la
ChIJrfAZju-VJoYR80v5qWv2t_c,Iron Warriors Motorcycle Club,,3,4.3,,+1 225-413-4191,https://streetviewpixels-pa.googleapis.com/v1/thumbnail?panoid=ApDJ16UPTBvpEKQP_XshnA&cb_client=search.gws-prod.gps&w=408&h=240&yaw=173.52998&pitch=0&thumbfov=100,Non-profit organization,Non-profit organization,Open All Days,"11386 Judalon Dr, Denham Springs, LA 70726, United States",https://www.google.com/maps/place/Iron+Warriors+Motorcycle+Club/data=!4m7!3m6!1s0x862695ef8e19f0ad:0xf7b7f66ba9f94bf3!8m2!3d30.505375!4d-90.8979543!16s%2Fg%2F1tlz_k0_!19sChIJrfAZju-VJoYR80v5qWv2t_c?authuser=0&hl=en&rclk=1,motorcycle clubs in baton rouge la,baton rouge la,baton rouge,la
ChIJM4SgbbEPU4cRAsFcuWybmvk,SUNDOWNERS motorcycle club,,7,4.3,,+1 801-920-7759,https://streetviewpixels-pa.googleapis.com/v1/thumbnail?panoid=31_62dISEjl4hZfn_8g2uw&cb_client=search.gws-prod.gps&w=408&h=240&yaw=354.9162&pitch=0&thumbfov=100,Club,Club,Open All Days,"140 W 22nd St, Ogden, UT 84401, United States",https://www.google.com/maps/place/SUNDOWNERS+motorcycle+club/data=!4m7!3m6!1s0x87530fb16da08433:0xf99a9b6cb95cc102!8m2!3d41.2273432!4d-111.9800321!16s%2Fg%2F11p77kjb20!19sChIJM4SgbbEPU4cRAsFcuWybmvk?authuser=0&hl=en&rclk=1,motorcycle clubs in ogden ut,ogden ut,ogden,ut
ChIJsYw7JZMWXIgR8tYj19NnZVI,State Burner's Motorcycle Club,,9,4.6,,,https://streetviewpixels-pa.googleapis.com/v1/thumbnail?panoid=tCSJkfyq5YwYdN2RPFBAkw&cb_client=search.gws-prod.gps&w=408&h=240&yaw=3.084663&pitch=0&thumbfov=100,Bar,Bar,Open All Days,"3923 Martin Luther King Jr Ave, Knoxville, TN 37914, United States",https://www.google.com/maps/place/State+Burner%27s+Motorcycle+Club/data=!4m7!3m6!1s0x885c1693253b8cb1:0x526567d3d723d6f2!8m2!3d35.9992601!4d-83.8758502!16s%2Fg%2F11h9ldzgw9!19sChIJsYw7JZMWXIgR8tYj19NnZVI?authuser=0&hl=en&rclk=1,motorcycle clubs in knoxville tn,knoxville tn,knoxville,tn
ChIJf9kgb3eTBasRXAnjIzxGy4A,Sons of God MC,"The Sons of God(r) Motorcycle Club Ministry is made up of Christian Bikers who share a vision of spreading the gospel of Jesus Christ with other bikers. The primary focus of this ministry is to reach the secular MC ""bikers"" who have not had the opportunity to have their lives touched by Jesus Christ.",1,5,http://www.sogmctngmg.org/,+1 865-224-0190,,Club,"Club, Service establishment, Religious organization",Open All Days,,https://www.google.com/maps/place/Sons+of+God+MC/data=!4m7!3m6!1s0xab0593776f20d97f:0x80cb463c23e3095c!8m2!3d35.8824005!4d-83.9252585!16s%2Fg%2F11srzgk6tv!19sChIJf9kgb3eTBasRXAnjIzxGy4A?authuser=0&hl=en&rclk=1,motorcycle clubs in knoxville tn,knoxville tn,knoxville,tn
ChIJ0Rp-gztj7UcR93B6EAewaLM,"3 Degrees Masonic Motorcycle Club, Chapter 20","Three Degrees Masonic Motorcycle Club (TDMMC) was established in 2006 in Dickson, TN. It consists of a National Chapter, TN Grand Chapter, and subordinate chapters across the State of Tennessee. TDMMC's main purpose is to promote Freemasonry in the motorcycling world and raise awareness of Masonic principles. It provides a wonderful outlet for Freemasons who enjoy riding. Although members wear identifiable ""colors"", TDMMC is not a 1% club and is only open to Master Masons in good standing. TDMMC operates in compliance with all codes and precepts of Freemasonry and falls under the jurisdiction of the Grand Lodge of the home state they are in. TDMMC also participates in benevolence work in cooperation with worthy charitable TN organizations.",0,0,https://tdmmc.org/,+1 423-316-6650,https://lh3.ggpht.com/p/AF1QipP1P0yb7UUBklDLfBDZ1azF__C_8pI74FTj8TTl=s1024,Charity,"Charity, Service establishment",Open All Days,,"https://www.google.com/maps/place/3+Degrees+Masonic+Motorcycle+Club,+Chapter+20/data=!4m7!3m6!1s0x47ed633b837e1ad1:0xb368b007107a70f7!8m2!3d35.958357!4d-83.9252585!16s%2Fg%2F11x6ntl7f0!19sChIJ0Rp-gztj7UcR93B6EAewaLM?authuser=0&hl=en&rclk=1",motorcycle clubs in knoxville tn,knoxville tn,knoxville,tn
ChIJs5XKsWuzGYgRqM_cEYYxHis,Iron Coffins M/C Grand Rapids,,2,5,https://www.facebook.com/IronCoffinsGR.MI/,,https://streetviewpixels-pa.googleapis.com/v1/thumbnail?panoid=FtgtaEJ-RYN1iw99YFL_Rw&cb_client=search.gws-prod.gps&w=408&h=240&yaw=158.6108&pitch=0&thumbfov=100,Club,Club,Open All Days,"1600 Marshall Ave SE, Grand Rapids, MI 49507, United States",https://www.google.com/maps/place/Iron+Coffins+M%2FC+Grand+Rapids/data=!4m7!3m6!1s0x8819b36bb1ca95b3:0x2b1e318611dccfa8!8m2!3d42.9343523!4d-85.6459708!16s%2Fg%2F11gw2k9qwd!19sChIJs5XKsWuzGYgRqM_cEYYxHis?authuser=0&hl=en&rclk=1,motorcycle clubs in grand rapids mi,grand rapids mi,grand rapids,mi
ChIJbYmrjHDLHogR39tEHsk4tI8,Bitely Boys Riders Club,,5,4.8,,+1 231-745-0090,https://streetviewpixels-pa.googleapis.com/v1/thumbnail?panoid=CJer_f5jsnC5tMeItOjogw&cb_client=search.gws-prod.gps&w=408&h=240&yaw=45.215298&pitch=0&thumbfov=100,Club,Club,Open All Days,"10722 N Bingham Ave, Bitely, MI 49309, United States",https://www.google.com/maps/place/Bitely+Boys+Riders+Club/data=!4m7!3m6!1s0x881ecb708cab896d:0x8fb438c91e44dbdf!8m2!3d43.7474662!4d-85.8601307!16s%2Fg%2F1tjpr37p!19sChIJbYmrjHDLHogR39tEHsk4tI8?authuser=0&hl=en&rclk=1,motorcycle clubs in grand rapids mi,grand rapids mi,grand rapids,mi
ChIJSyFXCQCtGYgRMvWHp4yZSR4,Grand Rapids Bike Polo,,1,5,,,https://lh3.ggpht.com/p/AG0ilSwZTtywZ6evE9lPz8yLeutuMt1H5Q5UT8uD6bzjIOPBpwZzXbhsVqnC8_tCCFguBYTuINaEVRH6JQc0mjRINA9jX-p4GOhutlp6xe4SrlwLHQYLFBnc0qOgJh3_lPENvwvujFJcgw=s1024,Sports club,Sports club,Open All Days,"459 Grand Ave NE, Grand Rapids, MI 49503, United States",https://www.google.com/maps/place/Grand+Rapids+Bike+Polo/data=!4m7!3m6!1s0x8819ad000957214b:0x1e49998ca787f532!8m2!3d42.9732959!4d-85.6542984!16s%2Fg%2F11lv8h2qn8!19sChIJSyFXCQCtGYgRMvWHp4yZSR4?authuser=0&hl=en&rclk=1,motorcycle clubs in grand rapids mi,grand rapids mi,grand rapids,mi
ChIJ-_FuYZitGYgRjPlWB0hTFpQ,Wild Bunch,,3,5,,+1 616-250-4486,https://lh3.ggpht.com/p/AG0ilSz965iy4M8QY5cNdY_SvhvzuYcvo3F7WbEF3LCzV7pllrtdmRNBlgSqBf_HoE7Ltd8RyEJDEg9ieUpwPWc550cRPPPSm8ePcBNbiygsmw3MQ-A2zA1JrGtobjbhjxDAUqL-5UGU6Q=s1024,Social club,Social club,Open All Days,"706 Wealthy St SE, Grand Rapids, MI 49503, United States",https://www.google.com/maps/place/Wild+Bunch/data=!4m7!3m6!1s0x8819ad98616ef1fb:0x941653480756f98c!8m2!3d42.955532!4d-85.65137!16s%2Fg%2F11cs2h9sc8!19sChIJ-_FuYZitGYgRjPlWB0hTFpQ?authuser=0&hl=en&rclk=1,motorcycle clubs in grand rapids mi,grand rapids mi,grand rapids,mi
ChIJI3p1dVW7-IgRG0JIuKIh3yQ,Disciple Christian Motorcycle Club,"Disciple Christian Motorcycle Club is the world's largest and fastest growing Christian MC. If you're looking for a group of men who are as serious about their faith as they are about riding motorcycles, come out and ride with Disciple! We are an ecumenical club that believes in the Apostle's Creed as our statement of faith. Our Mission: To Disciple Men to have a Daily Word and Prayer Time and to Support the 1%er World with Prayer.",14,4.4,http://www.disciplechristianmc.com/,,https://lh3.ggpht.com/p/AF1QipMZSUDF7zFZ24b32RTlUK8eFPbVgnSKtxziB9gb=s1024,Religious organization,"Religious organization, Service establishment",Open All Days,,https://www.google.com/maps/place/Disciple+Christian+Motorcycle+Club/data=!4m7!3m6!1s0x88f8bb5575757a23:0x24df21a2b848421b!8m2!3d46.423669!4d-129.9427086!16s%2Fg%2F11gfk03zn6!19sChIJI3p1dVW7-IgRG0JIuKIh3yQ?authuser=0&hl=en&rclk=1,motorcycle clubs in columbia sc,columbia sc,columbia,sc
ChIJEWFESfsBVogRmtHvO1jV88I,Smoke Out Motorcycle Rally,,3,4.3,http://smokeoutrally.com/,+1 803-210-7272,https://streetviewpixels-pa.googleapis.com/v1/thumbnail?panoid=pNaehw76h6JczA2bo8u1Jg&cb_client=search.gws-prod.gps&w=408&h=240&yaw=149.35356&pitch=0&thumbfov=100,Event management company,Event management company,Open All Days,"116 Harborside Cir, Columbia, SC 29229, United States",https://www.google.com/maps/place/Smoke+Out+Motorcycle+Rally/data=!4m7!3m6!1s0x885601fb49446111:0xc2f3d5583befd19a!8m2!3d34.1762685!4d-80.8878883!16s%2Fg%2F11ggn1fvt_!19sChIJEWFESfsBVogRmtHvO1jV88I?authuser=0&hl=en&rclk=1,motorcycle clubs in columbia sc,columbia sc,columbia,sc
ChIJM5YOnJu8-IgRbHCCsO7EQfU,Capital Crew,,0,0,,,https://streetviewpixels-pa.googleapis.com/v1/thumbnail?panoid=8d8PAYR5JD-S8xBwuQDyRg&cb_client=search.gws-prod.gps&w=408&h=240&yaw=261.43863&pitch=0&thumbfov=100,,,Open All Days,"Idlewood Dr, West Columbia, SC 29169, United States",https://www.google.com/maps/place/Capital+Crew/data=!4m7!3m6!1s0x88f8bc9b9c0e9633:0xf541c4eeb082706c!8m2!3d33.9771256!4d-81.0819549!16s%2Fg%2F11hm3xj56w!19sChIJM5YOnJu8-IgRbHCCsO7EQfU?authuser=0&hl=en&rclk=1,motorcycle clubs in columbia sc,columbia sc,columbia,sc
ChIJJWKX23gtWIgRoLMGq_2TgV4,The Knights Templar (MC),Motorcycle Club,1,1,http://theknightstemplarmc.org/,,,Club,"Club, Service establishment",Open All Days,,https://www.google.com/maps/place/The+Knights+Templar+%28MC%29/data=!4m7!3m6!1s0x88582d78db976225:0x5e8193fdab06b3a0!8m2!3d46.423669!4d-129.9427086!16s%2Fg%2F11h4676c7d!19sChIJJWKX23gtWIgRoLMGq_2TgV4?authuser=0&hl=en&rclk=1,motorcycle clubs in columbia sc,columbia sc,columbia,sc
ChIJpyiDVrz_VYgRvf2SYH9qGC4,Columbia SC Buffalo Soldiers Motorcycle Club,,0,0,,,https://streetviewpixels-pa.googleapis.com/v1/thumbnail?panoid=HpTKcXU9fa51p2IesZIQ9w&cb_client=search.gws-prod.gps&w=408&h=240&yaw=304.0341&pitch=0&thumbfov=100,Club,Club,Open All Days,"Elgin, SC 29045, United States",https://www.google.com/maps/place/Columbia+SC+Buffalo+Soldiers+Motorcycle+Club/data=!4m7!3m6!1s0x8855ffbc568328a7:0x2e186a7f6092fdbd!8m2!3d34.1709826!4d-80.794252!16s%2Fg%2F11trs3t1l7!19sChIJpyiDVrz_VYgRvf2SYH9qGC4?authuser=0&hl=en&rclk=1,motorcycle clubs in columbia sc,columbia sc,columbia,sc
ChIJ-xvVC9qN3okRCljRKt85eGY,Brothers of Lostboyz MC,,9,4.9,,+1 518-925-7594,https://lh3.ggpht.com/p/AF1QipNHfjAGwmxU6dpKjpbd2LAniLSixOfktU65w_w=s1024,Club,"Club, Service establishment",Open All Days,,"https://www.google.com/maps/place/Brothers+of+Lostboyz+MC/@38.2881304,-171.4194574,3z/data=!3m1!4b1!4m6!3m5!1s0x89de8dda0bd51bfb:0x667839df2ad1580a!8m2!3d46.423669!4d-129.9427086!16s%2Fg%2F11f_hgt_42?authuser=0&hl=en&entry=ttu&g_ep=EgoyMDI1MTIwOS4wIKXMDSoASAFQAw%3D%3D",motorcycle clubs in albany ny,albany ny,albany,ny
ChIJL26k3HLZ54kRbT92tTMAIgo,New Haven Horseshoe Club,,4,4,,+1 203-421-4510,https://streetviewpixels-pa.googleapis.com/v1/thumbnail?panoid=4D2zRE1IgvqPamz696U2-w&cb_client=search.gws-prod.gps&w=408&h=240&yaw=103.53115&pitch=0&thumbfov=100,Sports club,Sports club,Open All Days,"Bowling Green, 81 Springside Ave, New Haven, CT 06515, United States",https://www.google.com/maps/place/New+Haven+Horseshoe+Club/data=!4m7!3m6!1s0x89e7d972dca46e2f:0xa220033b5763f6d!8m2!3d41.3312975!4d-72.9555608!16s%2Fg%2F1264c1bn5!19sChIJL26k3HLZ54kRbT92tTMAIgo?authuser=0&hl=en&rclk=1,motorcycle clubs in new haven ct,new haven ct,new haven,ct
ChIJ-Te6BnGX7ocRLZnvPRKAVh4,El Forastero MC Clubhouse,,26,5,,,https://streetviewpixels-pa.googleapis.com/v1/thumbnail?panoid=mqrYfXaQmgbhbN885QKsEg&cb_client=search.gws-prod.gps&w=408&h=240&yaw=351.42267&pitch=0&thumbfov=100,Bar,Bar,Open All Days,"2539 E Walnut St, Des Moines, IA 50317, United States",https://www.google.com/maps/place/El+Forastero+MC+Clubhouse/data=!4m7!3m6!1s0x87ee977106ba37f9:0x1e5680123def992d!8m2!3d41.593108!4d-93.568253!16s%2Fg%2F11cn2wxdr4!19sChIJ-Te6BnGX7ocRLZnvPRKAVh4?authuser=0&hl=en&rclk=1,motorcycle clubs in des moines ia,des moines ia,des moines,ia
ChIJWdoBZtSb7ocRQx3FIiAvu6o,Mid Iowa Trail Riders Association,,0,0,http://www.ridemitra.com/,,https://streetviewpixels-pa.googleapis.com/v1/thumbnail?panoid=qjyVqVc_bEW3g1JWcG53yw&cb_client=search.gws-prod.gps&w=408&h=240&yaw=268.76074&pitch=0&thumbfov=100,Club,Club,Open All Days,"Chuck's Restaurant, 3610 6th Ave, Des Moines, IA 50313, United States",https://www.google.com/maps/place/Mid+Iowa+Trail+Riders+Association/data=!4m7!3m6!1s0x87ee9bd46601da59:0xaabb2f2022c51d43!8m2!3d41.6280256!4d-93.6249447!16s%2Fg%2F11c1357p2g!19sChIJWdoBZtSb7ocRQx3FIiAvu6o?authuser=0&hl=en&rclk=1,motorcycle clubs in des moines ia,des moines ia,des moines,ia
ChIJAQBkZBWe7ocRDtI2FIcFMi4,Des Moines Enduro Riders,,0,0,,+1 515-210-2289,https://streetviewpixels-pa.googleapis.com/v1/thumbnail?panoid=69ETSUvoigmfy7yQoWjZZQ&cb_client=search.gws-prod.gps&w=408&h=240&yaw=38.662247&pitch=0&thumbfov=100,,,Open All Days,"7827 University Blvd, Clive, IA 50325, United States",https://www.google.com/maps/place/Des+Moines+Enduro+Riders/data=!4m7!3m6!1s0x87ee9e1564640001:0x2e3205871436d20e!8m2!3d41.6012417!4d-93.7249425!16s%2Fg%2F11h06n5tft!19sChIJAQBkZBWe7ocRDtI2FIcFMi4?authuser=0&hl=en&rclk=1,motorcycle clubs in des moines ia,des moines ia,des moines,ia
ChIJu2h8OLSZ7ocReB6WU1Nz9Pk,Iowa Latino Cycling Club,"El Club Latino de Ciclismo de Iowa es un club de ciclismo de mucha dedicacion y estamos orgullosos de el. Tenemos corredores de todas las edades.
Nuestro objetivo es animar a las personas a ir en bicicleta para hacer ejercicio, socializar, viajar y por supuesto ... !Divertirse!.
Ya sea que estemos en las carreteras, los senderos pavimentados o los caminos de tierra ... !Nos encanta todo!.",1,5,http://www.latinocc.org/,+1 515-313-5757,https://lh3.ggpht.com/p/AF1QipNtcPAPE0KdyQapqq1Ueof4fa8jjN82zww7AgB4=s1024,Sports club,Sports club,Open All Days,"1541 E Grand Ave, Des Moines, IA 50316, United States",https://www.google.com/maps/place/Iowa+Latino+Cycling+Club/data=!4m7!3m6!1s0x87ee99b4387c68bb:0xf9f4735353961e78!8m2!3d41.5940907!4d-93.5934218!16s%2Fg%2F11sgy28dr9!19sChIJu2h8OLSZ7ocReB6WU1Nz9Pk?authuser=0&hl=en&rclk=1,motorcycle clubs in des moines ia,des moines ia,des moines,ia
ChIJRUmgLQD55IcRuu3QOwEU7sg,Chosen few m/c club,,2,5,,,https://streetviewpixels-pa.googleapis.com/v1/thumbnail?panoid=-dvbyOA1D1A2RN0N12ap5w&cb_client=search.gws-prod.gps&w=408&h=240&yaw=82.16941&pitch=0&thumbfov=100,Association / Organization,Association / Organization,Open All Days,"1027 9th St SW, Cedar Rapids, IA 52404, United States",https://www.google.com/maps/place/Chosen+few+m%2Fc+club/data=!4m7!3m6!1s0x87e4f9002da04945:0xc8ee14013bd0edba!8m2!3d41.9657688!4d-91.6808144!16s%2Fg%2F11y3s4rr2_!19sChIJRUmgLQD55IcRuu3QOwEU7sg?authuser=0&hl=en&rclk=1,motorcycle clubs in des moines ia,des moines ia,des moines,ia
ChIJyWaHluTZMIgRAwDmeufdB4o,Greater Akron Motorcycle Club,,8,5,,,https://streetviewpixels-pa.googleapis.com/v1/thumbnail?panoid=jjWg6XG4-tpSGjvOBlIdFg&cb_client=search.gws-prod.gps&w=408&h=240&yaw=188.82407&pitch=0&thumbfov=100,Sports club,Sports club,Open All Days,"1540 Smith Rd, Akron, OH 44313, United States",https://www.google.com/maps/place/Greater+Akron+Motorcycle+Club/data=!4m7!3m6!1s0x8830d9e4968766c9:0x8a07dde77ae60003!8m2!3d41.1405639!4d-81.5644278!16s%2Fg%2F11tssd8d3w!19sChIJyWaHluTZMIgRAwDmeufdB4o?authuser=0&hl=en&rclk=1,motorcycle clubs in akron oh,akron oh,akron,oh
ChIJI0ib_p7VMIgR4sW3fjstCoM,"Fifth Chapter Motorcycle Club, Akron","   The Fifth Chapter MC is comprised of Recovering Alcoholics & Addicts. All members must practice abstinence of ingestion and injection of all mood altering chemicals, and subscribe to the moral and spiritual principles set forth in the book, ""Alcoholics Anonymous"".
Possession of alcohol and/or illegal drugs is prohibited at all Fifth Chapter functions. Members are required to conduct themselves in a manner above reproach with respect to the law and community standards. These rules of conduct are strictly enforced.

Our purpose is to promote sane and sober motorcycling, and to provide help for those who wish to conquer the slavery of addiction.

``Bikers: If you drink or use that`s your business. But if you want to quit ...",9,4.9,http://www.fifthchaptermc.com/home.html,+1 216-337-6126,https://lh3.ggpht.com/p/AG0ilSwLsc6KTEqbzNTKPgTdSvYWPmGtnvqegSiw7aHUVF-dRdNdaR34ShdCusS5B5TOHfpLKA6ldO766Me-rKoqw9nl94FJ6kswil46hJ5mvOAXIKMhxYHGvjofTricKzdyClbTXPpl=s1024,Non-profit organization,Non-profit organization,Open All Days,"1902 Manchester Rd, Akron, OH 44314, United States","https://www.google.com/maps/place/Fifth+Chapter+Motorcycle+Club,+Akron/data=!4m7!3m6!1s0x8830d59efe9b4823:0x830a2d3b7eb7c5e2!8m2!3d41.047313!4d-81.5474463!16s%2Fg%2F11t_t_4vvj!19sChIJI0ib_p7VMIgR4sW3fjstCoM?authuser=0&hl=en&rclk=1",motorcycle clubs in akron oh,akron oh,akron,oh
ChIJI6iMrvwpMYgRV-YL9pbxfzQ,Zulus,,103,4.5,,+1 330-809-2889,https://lh3.ggpht.com/p/AG0ilSweeeNU9MJzdKvqzjpGrvmaEsbe4BOu8HAx_AoXdbSqPNmuVGZKFz6WkiiL8DD_H-pkzmS3-q5yHGR9vd8G7CI_fumFC67n5z4RTa3TI9Llg1Aj7KVvlOqXpP_8PuVMm1C1BKsc=s1024,Bar,Bar,Open All Days,"461 Clay St, Akron, OH 44311, United States",https://www.google.com/maps/place/Zulus/data=!4m7!3m6!1s0x883129fcae8ca823:0x347ff196f60be657!8m2!3d41.0569305!4d-81.5106887!16s%2Fg%2F11c1n2n6_8!19sChIJI6iMrvwpMYgRV-YL9pbxfzQ?authuser=0&hl=en&rclk=1,motorcycle clubs in akron oh,akron oh,akron,oh
ChIJDzQMueLVMIgR2DEVsvC8TbU,North Coast Motorcycle Club,,1,5,,,https://streetviewpixels-pa.googleapis.com/v1/thumbnail?panoid=RyXEILGBPcudNQreyZsMwQ&cb_client=search.gws-prod.gps&w=408&h=240&yaw=60.797863&pitch=0&thumbfov=100,,,Open All Days,"1415 S Main St, Akron, OH 44301, United States",https://www.google.com/maps/place/North+Coast+Motorcycle+Club/data=!4m7!3m6!1s0x8830d5e2b90c340f:0xb54dbcf0b21531d8!8m2!3d41.048482!4d-81.5276166!16s%2Fg%2F11gx_n673p!19sChIJDzQMueLVMIgR2DEVsvC8TbU?authuser=0&hl=en&rclk=1,motorcycle clubs in akron oh,akron oh,akron,oh
ChIJhaRyj44R3ogR5wSq7HCzheE,CVMA(r) 20-1,,2,5,http://cvmaflorida.org/,+1 321-220-9075,https://streetviewpixels-pa.googleapis.com/v1/thumbnail?panoid=80gvZZiUoMtGeQ_CRUhmjw&cb_client=search.gws-prod.gps&w=408&h=240&yaw=327.278&pitch=0&thumbfov=100,Veterans organization,Veterans organization,Open All Days,"1002 E New Haven Ave, Melbourne, FL 32901, United States",https://www.google.com/maps/place/CVMA%C2%AE+20-1/data=!4m7!3m6!1s0x88de118e8f72a485:0xe185b370ecaa04e7!8m2!3d28.0786249!4d-80.6041805!16s%2Fg%2F11f63xn_0l!19sChIJhaRyj44R3ogR5wSq7HCzheE?authuser=0&hl=en&rclk=1,motorcycle clubs in palm bay fl,palm bay fl,palm bay,fl
ChIJ4SX1vpwN3ogRHj0vS8Alm_A,s1kcat,,1,4,https://www.instagram.com/s1kcat/,,,Motoring club,"Motoring club, Service establishment",Open All Days,,https://www.google.com/maps/place/s1kcat/data=!4m7!3m6!1s0x88de0d9cbef525e1:0xf09b25c04b2f3d1e!8m2!3d28.481232!4d-81.3427941!16s%2Fg%2F11x03j8wyy!19sChIJ4SX1vpwN3ogRHj0vS8Alm_A?authuser=0&hl=en&rclk=1,motorcycle clubs in palm bay fl,palm bay fl,palm bay,fl
ChIJO2ybOMTM7wMRjVD47quOEZ0,Level Up Moto,"We plan awesome itineraries on the open road to amazing local routes and famous motorcycling destinations around the world. At the racetrack, our Pros assist in navigating the pit area, conduct race line strategy meetings, and provide valuable feedback during laps to aid in your improvement. They will capture stunning photographs and videos of you during your time together. They can also share valuable insights and allow you to follow them closely to observe proper riding technique in action.",5,5,https://www.levelupmoto.com/services,+1 612-361-6943,https://lh3.ggpht.com/p/AF1QipMOrQSGfr_OT4jxilETQsLh1MsBdnHQQSbphSDk=s1024,Motoring club,"Motoring club, Service establishment, Marketing agency, Photography service, Video production service",Open All Days,,https://www.google.com/maps/place/Level+Up+Moto/data=!4m7!3m6!1s0x3efccc4389b6c3b:0x9d118eabeef8508d!8m2!3d46.4419165!4d-93.3614534!16s%2Fg%2F11v0_3h7rf!19sChIJO2ybOMTM7wMRjVD47quOEZ0?authuser=0&hl=en&rclk=1,motorcycle clubs in palm bay fl,palm bay fl,palm bay,fl
ChIJVVXl8Rxt54gR88X-T8Yj8wc,"Marine Veterans Motorcycle Association,Inc","The Marine Veterans Motorcycle Association, Inc FL is a 501c3 non-profit organization dedicated to supporting military veterans, first responders and their families who are in need of financial assistance. We do this by having fundraising raffles and events. The Marine Veterans Motorcycle, Inc FL is made up of Honorably Discharged United States Marines and their family members. We also help direct veterans to PTSD counselors and obtaining their VA benefits.
For memberships info contact ""Striker"" at usmcharvey03@yahoo.com or text him at 386-801-1120.",3,4.7,,+1 386-801-1120,https://lh3.ggpht.com/p/AF1QipMU6GkuYp1p-tCqA7YGHMaNw0FJaT96ZpfZaJ1G=s1024,Non-profit organization,"Non-profit organization, Service establishment",Open All Days,,"https://www.google.com/maps/place/Marine+Veterans+Motorcycle+Association,Inc/data=!4m7!3m6!1s0x88e76d1cf1e55555:0x7f323c64ffec5f3!8m2!3d46.423669!4d-129.9427086!16s%2Fg%2F11fll6945p!19sChIJVVXl8Rxt54gR88X-T8Yj8wc?authuser=0&hl=en&rclk=1",motorcycle clubs in palm bay fl,palm bay fl,palm bay,fl
ChIJVVWVPOpmhYARNSSupSxbrgc,Wanderlust Motorcycle Club,,0,0,,,https://streetviewpixels-pa.googleapis.com/v1/thumbnail?panoid=DJWQwbXH31WTNcsrk0Qk4Q&cb_client=search.gws-prod.gps&w=408&h=240&yaw=333.96152&pitch=0&thumbfov=100,,,Open All Days,"1170 Concord Ave, Concord, CA 94520, United States",https://www.google.com/maps/place/Wanderlust+Motorcycle+Club/data=!4m7!3m6!1s0x808566ea3c955555:0x7ae5b2ca5ae2435!8m2!3d37.9798264!4d-122.0561341!16s%2Fg%2F11j03bxknm!19sChIJVVWVPOpmhYARNSSupSxbrgc?authuser=0&hl=en&rclk=1,motorcycle clubs in concord ca,concord ca,concord,ca
ChIJ5TYt_e3juocRvNrJMIcPIsM,Black Sabbath M.C,,14,5,,,https://lh3.ggpht.com/p/AG0ilSz6vT6mAM6YnisYDmAlRZTHukY8U0o95rWMT6WwcqeP4RipzElGOOGYHalZYSVRCN9-tphJMI2RJTdX-GspO-jCYxWrddg9OYncY-G524Gaz1emyw7X1mUtYqu0AbmUPQGVhuw-zg=s1024,Association / Organization,Association / Organization,Open All Days,"816 S Broadway, Wichita, KS 67211, United States",https://www.google.com/maps/place/Black+Sabbath+M.C/data=!4m7!3m6!1s0x87bae3edfd2d36e5:0xc3220f8730c9dabc!8m2!3d37.6769341!4d-97.3353271!16s%2Fg%2F11gg682nwh!19sChIJ5TYt_e3juocRvNrJMIcPIsM?authuser=0&hl=en&rclk=1,motorcycle clubs in wichita ks,wichita ks,wichita,ks
ChIJ3SFjmRfnuocRQYiZGEmHvAs,Veterans Motorcycle Club,,9,5,,+1 316-284-1275,https://lh3.ggpht.com/p/AF1QipOzMvOfLamS5FxTU_PnBNuRvDsff0AldeROaXIr=s1024,Club,Club,Open All Days,"4714 S Seneca St, Wichita, KS 67217, United States",https://www.google.com/maps/place/Veterans+Motorcycle+Club/data=!4m7!3m6!1s0x87bae717996321dd:0xbbc874918998841!8m2!3d37.6094294!4d-97.3518234!16s%2Fg%2F11fmw4y44b!19sChIJ3SFjmRfnuocRQYiZGEmHvAs?authuser=0&hl=en&rclk=1,motorcycle clubs in wichita ks,wichita ks,wichita,ks
