place_id,name,description,reviews,rating,website,phone,featured_image,main_category,categories,closed_on,address,link,query,query-02,City,State
ChIJWYA3lmL0wokRY-Jemz6n-1k,Chingaling Mc,,12,4.9,https://www.onepercenterbikers.com/ching-a-ling-nomads-mc-motorcycle-club/,,https://lh3.ggpht.com/p/AG0ilSwxQWvt5YOwI59QJiUFOfezTtZXxBpme3P99uyZP3Az1Z7daJP3bqBeUmUSUuiLcZ6AF-wwCR1T-yg1dCy4b8YMQ1JZGrgRjCvnWPlYCwl4fhETdzUofKrCmbStghaQmVgXHqs=s1024,Social club,Social club,Open All Days,"2106 Hughes Ave, Bronx, NY 10457, United States",https://www.google.com/maps/place/Chingaling+Mc/data=!4m7!3m6!1s0x89c2f46296378059:0x59fba73e9b5ee263!8m2!3d40.8491279!4d-73.8905011!16s%2Fg%2F11clyb8mmy!19sChIJWYA3lmL0wokRY-Jemz6n-1k?authuser=0&hl=en&rclk=1,motorcycle clubs in new york ny,new york ny,new york,ny
ChIJscPgpLlawokRDI0Zun7121Q,Dirty Ones Mc New York,,9,5,,,https://lh3.ggpht.com/p/AG0ilSxJGFoUMll2Ds1UefsXwtz_WYncy0zvO69ABc14BLPoGUUReJky-Y2T2tJuqeEBrahFO22-mMMDw5VBAWE2lJ5_pYI9a4wa98bqCR42zk7vHZfnxxbwtWF7o4CZcsF0u7i8MtpzToqFMVq2=s1024,Store,"Store, Association / Organization",Open All Days,"4208 3rd Ave, Brooklyn, NY 11232, United States",https://www.google.com/maps/place/Dirty+Ones+Mc+New+York/data=!4m7!3m6!1s0x89c25ab9a4e0c3b1:0x54dbf57eba198d0c!8m2!3d40.6521377!4d-74.0103833!16s%2Fg%2F11gm8_wb18!19sChIJscPgpLlawokRDI0Zun7121Q?authuser=0&hl=en&rclk=1,motorcycle clubs in new york ny,new york ny,new york,ny
ChIJq6puCGVewokRhcXlXGNpTnI,Punishers LEMC NYC,,5,4.2,http://www.nycpunisherslemc.org/,,https://lh3.ggpht.com/p/AF1QipPovaipbyKS3NOk-VwxqJ9MH_PPUsKptiBbAccB=s1024,Event venue,"Event venue, Association / Organization",Open All Days,"66-85 73rd Pl, Middle Village, NY 11379, United States",https://www.google.com/maps/place/Punishers+LEMC+NYC/data=!4m7!3m6!1s0x89c25e65086eaaab:0x724e69635ce5c585!8m2!3d40.7130593!4d-73.8793262!16s%2Fg%2F11ghr05ffc!19sChIJq6puCGVewokRhcXlXGNpTnI?authuser=0&hl=en&rclk=1,motorcycle clubs in new york ny,new york ny,new york,ny
ChIJMRdGAr5ZwokRsENiNPCgZ_0,Sirens MC,,0,0,http://sirensnyc.com/,+1 212-620-7310,https://streetviewpixels-pa.googleapis.com/v1/thumbnail?panoid=I7v38MPOIEidY13Ax5d8uQ&cb_client=search.gws-prod.gps&w=408&h=240&yaw=194.31429&pitch=0&thumbfov=100,Gay & lesbian organization,Gay & lesbian organization,Open All Days,"208 W 13th St, New York, NY 10011, United States",https://www.google.com/maps/place/Sirens+MC/data=!4m7!3m6!1s0x89c259be02461731:0xfd67a0f0346243b0!8m2!3d40.7380161!4d-74.0011104!16s%2Fg%2F11c58wtv6t!19sChIJMRdGAr5ZwokRsENiNPCgZ_0?authuser=0&hl=en&rclk=1,motorcycle clubs in new york ny,new york ny,new york,ny
ChIJ0e4-w7r1wokRyuZXiVYJkIw,Black Falcons MC Clubhouse,,86,4.7,,,https://lh3.ggpht.com/p/AG0ilSwz04Ysr_zwTEH_NZvl0g0MqEqYKXejudXy7C-BCOLchM0dira5oqVzGiYpZ9kJe2OAqYJMkW45f29ZE5malov7seuW-fLaQhDEOQs9DVk_7-zvlR4bj3WUo8_IQaFpq3S9cYMxEg=s1024,Event venue,Event venue,Open All Days,"523 Bruckner Blvd, Bronx, NY 10455, United States",https://www.google.com/maps/place/Black+Falcons+MC+Clubhouse/data=!4m7!3m6!1s0x89c2f5bac33eeed1:0x8c9009568957e6ca!8m2!3d40.8109724!4d-73.9017189!16s%2Fg%2F11bydp_25b!19sChIJ0e4-w7r1wokRyuZXiVYJkIw?authuser=0&hl=en&rclk=1,motorcycle clubs in new york ny,new york ny,new york,ny
ChIJOwhB3k_HwoAR7MxdlJw3oJ4,Bike Shed Moto Co,"Unique Restaurant, Bar, Cafe, Booths, Lounge, Barbershop, Tattoo Studio, Moto Culture, Moto Community, Cafe, Booths, Lounge, Barbershop, Tattoo Studio, Retail, Events, Galleries, Membership, and much more. A vast 30,000 Square foot venue. Breakfast, Brunch, Lunch, Dinner & Drinks from early till late.

Great for Dates, Birthdays, Private Dinners & Events, Family Dining.
Open till Late Evening.
CHECK OUR HOURS BY PHONE DURING THESE DIFFICULT TIMES

Enjoy our Common ground, where people from all walks of life come together to share their passion for two-wheels alongside the culture, lifestyle, community, and creative spirit inspired by them.

Friendly & inclusive. Kids & Dogs welcome. Booking recommended, but always room for walk-ins.",771,4.8,https://bikeshedmoto.com/,+1 213-465-7661,https://lh3.ggpht.com/p/AF1QipMgdGIyYsPksHYXFrc--pzOXU9qR2nzfsVhxv8X=s1024,Restaurant,"Restaurant, Breakfast restaurant, Brunch restaurant, Cafe, Cocktail bar, Coffee shop, Vegan restaurant",Open All Days,"1580 Industrial St, Los Angeles, CA 90021, United States",https://www.google.com/maps/place/Bike+Shed+Moto+Co/data=!4m7!3m6!1s0x80c2c74fde41083b:0x9ea0379c945dccec!8m2!3d34.0355855!4d-118.2357722!16s%2Fg%2F11mvrs1nqb!19sChIJOwhB3k_HwoAR7MxdlJw3oJ4?authuser=0&hl=en&rclk=1,motorcycle clubs in los angeles ca,los angeles ca,los angeles,ca
ChIJkwPM0r3LwoARnjtIauXXfyQ,Magic Wheels Motorcycle Club,,38,4.8,,,https://lh3.ggpht.com/p/AG0ilSx4ORGV9UjibgdV7jSPxJNaNUUFMDwrTcSbdqY0fzwd53_jCWPlGxaJaFhifIM7_vvy-mz3fm8mVultMkDAu02EG4YDzAGZC27mHSzdQqCUObVcGDOGLlO_3wOqcKDqjnjOUH4=s1024,Bar,Bar,Open All Days,"13125 S Broadway, Los Angeles, CA 90061, United States",https://www.google.com/maps/place/Magic+Wheels+Motorcycle+Club/data=!4m7!3m6!1s0x80c2cbbdd2cc0393:0x247fd7e56a483b9e!8m2!3d33.9125548!4d-118.2788047!16s%2Fg%2F11gtcj24w4!19sChIJkwPM0r3LwoARnjtIauXXfyQ?authuser=0&hl=en&rclk=1,motorcycle clubs in los angeles ca,los angeles ca,los angeles,ca
ChIJcxa29qDJwoARlQG0r4H9Pro,DO's Motorcycle Club,,3,4.7,,,https://streetviewpixels-pa.googleapis.com/v1/thumbnail?panoid=INTcwbKyyBjGqtJuu60aAw&cb_client=search.gws-prod.gps&w=408&h=240&yaw=169.40341&pitch=0&thumbfov=100,Night club,Night club,Open All Days,"8207 S Central Ave, Los Angeles, CA 90001, United States",https://www.google.com/maps/place/DO%27s+Motorcycle+Club/data=!4m7!3m6!1s0x80c2c9a0f6b61673:0xba3efd81afb40195!8m2!3d33.96451!4d-118.2566635!16s%2Fg%2F11fhxwdf11!19sChIJcxa29qDJwoARlQG0r4H9Pro?authuser=0&hl=en&rclk=1,motorcycle clubs in los angeles ca,los angeles ca,los angeles,ca
ChIJNStn9VLJwoARougLXi2Chfw,Undisputed MC Los Angeles,,51,4.6,,,https://lh3.ggpht.com/p/AG0ilSyiDIC0ShQmvkkXi12eIQnbuFmzy9YxRxxIhcVUd8zMQq_d-tyIAdPOunA0R4-PRvobs2aYXcEek37q4H9qAD41qObTjy3t28tNOATB-si7Nj5HvolG1ZMPFcPEw3gHVwXWoXw5nA=s1024,Motoring club,Motoring club,Open All Days,"8620 S Broadway, Los Angeles, CA 90003, United States",https://www.google.com/maps/place/Undisputed+MC+Los+Angeles/data=!4m7!3m6!1s0x80c2c952f5672b35:0xfc85822d5e0be8a2!8m2!3d33.9595541!4d-118.2778545!16s%2Fg%2F11h79w7d78!19sChIJNStn9VLJwoARougLXi2Chfw?authuser=0&hl=en&rclk=1,motorcycle clubs in los angeles ca,los angeles ca,los angeles,ca
ChIJ10DdBIvKwoARUtV4RXZBUTU,Rare Breed MC Clubhouse,,372,4.7,https://rarebreedmc.com/,+1 323-458-4298,https://lh3.ggpht.com/p/AG0ilSxbV-U6OoTrAfHCRldDjMOc90iT4l-qwiWYjt54Qw6b0ZVG8UxK1graAQ7YUkVPpBpynG3XOfQH9sMe1EOsbo7buKNBmc7rnJxqh1FWhNqUTs2EL6_f9ri8o1tQH1vdTGZdD4uzGw=s1024,Motoring club,"Motoring club, Night club",Open All Days,"15320 S Broadway, Gardena, CA 90248, United States",https://www.google.com/maps/place/Rare+Breed+MC+Clubhouse/data=!4m7!3m6!1s0x80c2ca8b04dd40d7:0x355141764578d552!8m2!3d33.8922629!4d-118.2783413!16s%2Fg%2F11c5btfxbk!19sChIJ10DdBIvKwoARUtV4RXZBUTU?authuser=0&hl=en&rclk=1,motorcycle clubs in los angeles ca,los angeles ca,los angeles,ca
ChIJcWgDZt8yDogRbkRChpxBhbs,Chicago Born Losers Motorcycle,,20,4.2,,+1 773-379-0138,https://streetviewpixels-pa.googleapis.com/v1/thumbnail?panoid=3fe8iunKfGHwOBKOuICJ4A&cb_client=search.gws-prod.gps&w=408&h=240&yaw=3.667846&pitch=0&thumbfov=100,Motorcycles,Motorcycles,Open All Days,"4420 W Madison St #4424, Chicago, IL 60624, United States",https://www.google.com/maps/place/Chicago+Born+Losers+Motorcycle/data=!4m7!3m6!1s0x880e32df66036871:0xbb85419c8642446e!8m2!3d41.8807717!4d-87.7363818!16s%2Fg%2F1vkxmvrf!19sChIJcWgDZt8yDogRbkRChpxBhbs?authuser=0&hl=en&rclk=1,motorcycle clubs in chicago il,chicago il,chicago,il
ChIJDVsrN7QtDogRaqx931mLRAA,BUFORDS 23 LE MC,,13,4.6,https://www.bluecrewlemc.com/,,https://lh3.ggpht.com/p/AF1QipNArbdXiWE2rNarikeZTgJwWDzGfSeCNjMD-hqe=s1024,Club,Club,Open All Days,"3031 S Archer Ave, Chicago, IL 60608, United States",https://www.google.com/maps/place/BUFORDS+23+LE+MC/data=!4m7!3m6!1s0x880e2db4372b5b0d:0x448b59df7dac6a!8m2!3d41.8394302!4d-87.6622244!16s%2Fg%2F11bw5m6qkm!19sChIJDVsrN7QtDogRaqx931mLRAA?authuser=0&hl=en&rclk=1,motorcycle clubs in chicago il,chicago il,chicago,il
ChIJJ2tZqW3ND4gRTIMyKimWfak,Latin American Motorcycle Association,L.A.M.A CHICAGO HQ,103,4.9,http://www.lamachicago.com/,+1 773-837-3051,https://lh3.ggpht.com/p/AG0ilSzfA6JrjbmHEkGgqWDfApnVqKo9miAhmnXu0XrAVICrT8jYA6CKwjFtRsm1J39XZNPJA6grsZjeLTYQ8-ZvQPwwfyUJkGWIxggQaeXyWVIQOptkFC_g3G7PA2YgtNuSzZ76Vzni=s1024,Association / Organization,Association / Organization,Open All Days,"3519 W Fullerton Ave, Chicago, IL 60647, United States",https://www.google.com/maps/place/Latin+American+Motorcycle+Association/data=!4m7!3m6!1s0x880fcd6da9596b27:0xa97d96292a32834c!8m2!3d41.9244354!4d-87.7145492!16s%2Fg%2F1td4q9bg!19sChIJJ2tZqW3ND4gRTIMyKimWfak?authuser=0&hl=en&rclk=1,motorcycle clubs in chicago il,chicago il,chicago,il
ChIJ1eXOS9goDogRiJiXoc2VBoQ,Dirty Doz Motorcycle Club,,35,4.7,,,https://lh3.ggpht.com/p/AG0ilSySaEskCwn9RZCoK3A4y5QfFwzw-Ihfo6NfKgiSieomYdoR1AHPXU0du4KfTWyDjGRCYhymfCaGwBCp2TMm9sE8Y993GXpySv4yIw1CrvAuu3BSRsR1Pl1JKq3oY76NNPJSQDs=s1024,Motorcycle dealer,Motorcycle dealer,Open All Days,"720 E 67th St, Chicago, IL 60637, United States",https://www.google.com/maps/place/Dirty+Doz+Motorcycle+Club/data=!4m7!3m6!1s0x880e28d84bcee5d5:0x840695cda1979888!8m2!3d41.7733827!4d-87.6073557!16s%2Fg%2F1262tsrhz!19sChIJ1eXOS9goDogRiJiXoc2VBoQ?authuser=0&hl=en&rclk=1,motorcycle clubs in chicago il,chicago il,chicago,il
ChIJd6ZLU3LLD4gRl_TtvIGbjuY,Sokol Riders Motorcycle Association,,41,4.9,http://www.facebook.com/sokolriders/?ref=page_internal,,https://lh3.ggpht.com/p/AG0ilSwBlI-vxYFp7ddWiMfpRAZ4IQktXagzaS9yMCC22fkZ6TyGNMbIJATvuGjnTVZRAn8y2R1m_jFdnEQ5Y3ZsFMhoLCpgej2jeGHWWWcokdp0xpHp3NrDoR1igTb4x4UG4fsBc0PQhw=s1024,Association / Organization,Association / Organization,Open All Days,"6701 W Diversey Ave, Chicago, IL 60707, United States",https://www.google.com/maps/place/Sokol+Riders+Motorcycle+Association/data=!4m7!3m6!1s0x880fcb72534ba677:0xe68e9b81bcedf497!8m2!3d41.9307421!4d-87.7931762!16s%2Fg%2F11dxdm71yl!19sChIJd6ZLU3LLD4gRl_TtvIGbjuY?authuser=0&hl=en&rclk=1,motorcycle clubs in chicago il,chicago il,chicago,il
ChIJPbDiLhO5jkMRHwkP-_bXNEY,Iron Legacy Motorcycle,"Iron Legacy Motorcycle Club is an independent, law abiding 99% motorcycle club.",19,5,https://ironlegacymc.com/,+1 786-742-4707,https://lh3.ggpht.com/p/AF1QipOyNqPkhyqVj4zggmNeKRmADIjl9Nx3HUNEGDGI=s1024,Non-profit organization,"Non-profit organization, Service establishment",Open All Days,,https://www.google.com/maps/place/Iron+Legacy+Motorcycle/data=!4m7!3m6!1s0x438eb9132ee2b03d:0x4634d7f6fb0f091f!8m2!3d25.782414!4d-80.2253934!16s%2Fg%2F11x1nzms97!19sChIJPbDiLhO5jkMRHwkP-_bXNEY?authuser=0&hl=en&rclk=1,motorcycle clubs in miami fl,miami fl,miami,fl
ChIJXWki25222YgRChpt9-2lCw0,MOTOSOCIETY RIDERS,,3,4.7,,+1 786-443-6635,https://streetviewpixels-pa.googleapis.com/v1/thumbnail?panoid=VIOoZCtzrNYz6kgQRPjiOg&cb_client=search.gws-prod.gps&w=408&h=240&yaw=189.3007&pitch=0&thumbfov=100,Association / Organization,Association / Organization,Open All Days,"556 W Flagler St Apt 1311, Miami, FL 33130, United States",https://www.google.com/maps/place/MOTOSOCIETY+RIDERS/data=!4m7!3m6!1s0x88d9b69ddb22695d:0xd0ba5edf76d1a0a!8m2!3d25.7732882!4d-80.203677!16s%2Fg%2F11fx81sggd!19sChIJXWki25222YgRChpt9-2lCw0?authuser=0&hl=en&rclk=1,motorcycle clubs in miami fl,miami fl,miami,fl
ChIJNR9fKJC42YgR66B2mw1nYyA,Cartel Baggers,,41,4,http://cartelbaggers.com/,+1 786-409-7833,https://lh3.ggpht.com/p/AF1QipNzLPIKBWca44ShMrdUqAlGm_-IYBU6sLi_V8eX=s1024,Motorcycle shop,Motorcycle shop,Open All Days,"4176 SW 74th Ct, Miami, FL 33155, United States",https://www.google.com/maps/place/Cartel+Baggers/data=!4m7!3m6!1s0x88d9b890285f1f35:0x2063670d9b76a0eb!8m2!3d25.7316487!4d-80.316303!16s%2Fg%2F1yfps5wry!19sChIJNR9fKJC42YgR66B2mw1nYyA?authuser=0&hl=en&rclk=1,motorcycle clubs in miami fl,miami fl,miami,fl
ChIJ___v_fC02YgR0Lms0Yi46Ck,BADD,A non profit 501c3 charity that raises awareness against drunk drivers. Checkout our cool prizes you can win!,27,4.9,https://store.baddworldwide.com/tickets,+1 844-427-2233,https://lh3.ggpht.com/p/AF1QipO-hakFOOu_1WOe2iZMZB2rEAEfRtyRZwZjXndq=s1024,Non-profit organization,Non-profit organization,Open All Days,"7130 SW 44th St, Miami, FL 33155, United States",https://www.google.com/maps/place/BADD/data=!4m7!3m6!1s0x88d9b4f0fdefffff:0x29e8b888d1acb9d0!8m2!3d25.7291624!4d-80.3096896!16s%2Fg%2F11ghr0_f5q!19sChIJ___v_fC02YgR0Lms0Yi46Ck?authuser=0&hl=en&rclk=1,motorcycle clubs in miami fl,miami fl,miami,fl
ChIJp-7QRcIF2YgRKwyakEa8Fpc,Gideons Motorcycle Club,,7,5,http://www.gideonsmcfl.com/,+1 561-305-6164,https://lh3.ggpht.com/p/AF1QipOHiMkeP8OTMr8uaCvpSbM8xM9rjcclN1EVzJKp=s1024,Motoring club,Motoring club,Open All Days,"2226 Mears Pkwy, Margate, FL 33063, United States",https://www.google.com/maps/place/Gideons+Motorcycle+Club/data=!4m7!3m6!1s0x88d905c245d0eea7:0x9716bc46909a0c2b!8m2!3d26.2508115!4d-80.1994254!16s%2Fg%2F11s7m0hzrx!19sChIJp-7QRcIF2YgRKwyakEa8Fpc?authuser=0&hl=en&rclk=1,motorcycle clubs in miami fl,miami fl,miami,fl
ChIJZVQUlaiwQIYREfvBRTG_89A,HARD RIDERS MC,"HARD RIDERS MC, INC. The first all African-American, all American Made Motorcycle Club in Houston, Texas, established in the year 2000.",53,4.7,http://www.hardridersmc.com/,+1 832-207-6525,https://lh3.ggpht.com/p/AF1QipPHEpydJhXGcLutNFZTeRfwpxu_tX9q4Ky1i-nz=s1024,Non-profit organization,Non-profit organization,Open All Days,"11239 Crown Park Dr, Houston, TX 77067, United States",https://www.google.com/maps/place/HARD+RIDERS+MC/data=!4m7!3m6!1s0x8640b0a895145465:0xd0f3bf3145c1fb11!8m2!3d29.9443178!4d-95.4477325!16s%2Fg%2F11b6sys_pv!19sChIJZVQUlaiwQIYREfvBRTG_89A?authuser=0&hl=en&rclk=1,motorcycle clubs in houston tx,houston tx,houston,tx
ChIJMeJ9c_u5QIYRulIRL9-4v7k,United Bikers Clubhouse,,22,4.7,,+1 713-631-3039,https://lh3.ggpht.com/p/AG0ilSw_SJ_Xf5Vv9sCpCmXn8rRlVTfk6V_5rgcgp3Yw5vTpx0Feuc4EV1XdUL2jsLnBlQ23oxw2P43aVSe1RSZKeXPzJbus-9ORT6QHxc54VGO1X-Xu3p4EjtX8UFgLJtoKEcfhQYxc=s1024,Association / Organization,Association / Organization,Open All Days,"770163524, 10410 Hirsch Rd, Houston, TX 77016, United States",https://www.google.com/maps/place/United+Bikers+Clubhouse/data=!4m7!3m6!1s0x8640b9fb737de231:0xb9bfb8df2f1152ba!8m2!3d29.8601552!4d-95.3185705!16s%2Fg%2F11clzr8sn5!19sChIJMeJ9c_u5QIYRulIRL9-4v7k?authuser=0&hl=en&rclk=1,motorcycle clubs in houston tx,houston tx,houston,tx
ChIJl6muv47GQIYRwcI68AVOX3c,Strokers Club,,13,4.5,,+1 713-688-3434,https://streetviewpixels-pa.googleapis.com/v1/thumbnail?panoid=NM2yQfJ7a8HHgFaCm8E_qA&cb_client=search.gws-prod.gps&w=408&h=240&yaw=91.727585&pitch=0&thumbfov=100,Club,Club,Open All Days,"2302 McAllister Rd, Houston, TX 77092, United States",https://www.google.com/maps/place/Strokers+Club/data=!4m7!3m6!1s0x8640c68ebfaea997:0x775f4e05f03ac2c1!8m2!3d29.8081005!4d-95.4632506!16s%2Fg%2F1tg5vfhx!19sChIJl6muv47GQIYRwcI68AVOX3c?authuser=0&hl=en&rclk=1,motorcycle clubs in houston tx,houston tx,houston,tx
ChIJix3qPQOVQIYRKQyKb-2oRVg,Lords Of The Throttle,,9,4.7,,+1 702-934-0028,https://streetviewpixels-pa.googleapis.com/v1/thumbnail?panoid=kWTByOtU29SHCl9dioOHsg&cb_client=search.gws-prod.gps&w=408&h=240&yaw=359.97922&pitch=0&thumbfov=100,Non-profit organization,Non-profit organization,Open All Days,"4523 Mowery Rd, Houston, TX 77047, United States",https://www.google.com/maps/place/Lords+Of+The+Throttle/data=!4m7!3m6!1s0x864095033dea1d8b:0x5845a8ed6f8a0c29!8m2!3d29.6364379!4d-95.3566383!16s%2Fg%2F11qqt2xjd4!19sChIJix3qPQOVQIYRKQyKb-2oRVg?authuser=0&hl=en&rclk=1,motorcycle clubs in houston tx,houston tx,houston,tx
ChIJE1oaoT1VzawRrlkZicvbWXQ,Sovereign Souls Motorcycle Club,The Sovereign Souls Motorcycle Club is an independent 3 piece Motorcycle Club founded in Houston in 2010.,3,5,https://www.sovereignsouls.club/,,https://lh3.ggpht.com/p/AF1QipOY_qlmeCcedd0MY0TPo2vyfTvDiRUppgSKG9OL=s1024,Club,"Club, Service establishment, Fraternal organization, Motorcycle driving school, Social club",Open All Days,,https://www.google.com/maps/place/Sovereign+Souls+Motorcycle+Club/data=!4m7!3m6!1s0xaccd553da11a5a13:0x7459dbcb891959ae!8m2!3d31.058628!4d-95.818468!16s%2Fg%2F11vdknr1l1!19sChIJE1oaoT1VzawRrlkZicvbWXQ?authuser=0&hl=en&rclk=1,motorcycle clubs in houston tx,houston tx,houston,tx
ChIJq6o66zKhToYRpfifzaf78eY,Scorpions Mc,,2,5,,,https://lh3.ggpht.com/p/AG0ilSyPpXhei3wjURGgzL7sQH_41dB3TK1HhgSRZ5s6WL-xJAS5Zz7L8g_pGzLFA54gYBmS1CDJpJkz1hfj99jdFP__9HIAHpm8lf5c8XrBGFZfhI3iAKfcxpCYndcooGS_ZcUUTI4LCdkTPdMq=s1024,Club,Club,Open All Days,"10750 Shiloh Rd, Dallas, TX 75228, United States",https://www.google.com/maps/place/Scorpions+Mc/data=!4m7!3m6!1s0x864ea132eb3aaaab:0xe6f1fba7cd9ff8a5!8m2!3d32.8438721!4d-96.6653715!16s%2Fg%2F11h3vbnwjp!19sChIJq6o66zKhToYRpfifzaf78eY?authuser=0&hl=en&rclk=1,motorcycle clubs in dallas tx,dallas tx,dallas,tx
ChIJV9a0Q-YzTIYRpZPD_KI1xGI,L.A.M.A. of Dallas,"The Dallas Chapter of the Latin American Motorcycle Association (L.A.M.A.) was founded July 5th, 2012. Since then, our chapter and its members have focused on promoting the sport of moto-tourism and the traditions of brotherhood, and generosity inherent in our culture across the North Texas area.
Since 2012 , the Dallas Chapter of L.A.M.A. has raised thousands of dollars for local and regional non-profit organizations; benefiting animal shelters and those less fortunate in our communities, as well as putting down thousands of miles on roads across the country.

We invite you to join the ride!",2,5,https://lamaofdallas.com/,,https://lh3.ggpht.com/p/AF1QipM_rEhQZPDC9gnE3ZpidqxxhYcGoGaN97HtG-b9=s1024,Motoring club,"Motoring club, Service establishment",Open All Days,,https://www.google.com/maps/place/L.A.M.A.+of+Dallas/data=!4m7!3m6!1s0x864c33e643b4d657:0x62c435a2fcc393a5!8m2!3d32.7430719!4d-96.963595!16s%2Fg%2F11k5h0nz29!19sChIJV9a0Q-YzTIYRpZPD_KI1xGI?authuser=0&hl=en&rclk=1,motorcycle clubs in dallas tx,dallas tx,dallas,tx
ChIJAWKcr1OcToYRMFCrgBh13x0,Strokers Ice House,Strokers Ice House is located next door to Rick Fairless' Strokers Dallas and we welcome you - Bike or no bike! Bring your friends and large groups and schedule your next special event - 7 days a week!,1753,4.7,http://strokersdallas.com/ice-house/,+1 214-351-5252,https://lh3.ggpht.com/p/AG0ilSxIs3mfHK2jiqSweMyvvhgmukrJfu33R3ui3SYIUvLZ8n6GM6cCXACctHE9zpPXD1v3Oq_UMP6RRVDUMnOP4VelgRtjJx5D-ngd62PGln9URRH1fEKfpD2Vy0z5LLDSvZDmxd1U=s1024,Bar,"Bar, Bar & grill, Hamburger restaurant, Takeout restaurant, Night club, Pool hall, Pub, Restaurant, Sandwich shop, Sports bar",Open All Days,"9310 Harry Hines Blvd, Dallas, TX 75235, United States",https://www.google.com/maps/place/Strokers+Ice+House/data=!4m7!3m6!1s0x864e9c53af9c6201:0x1ddf751880ab5030!8m2!3d32.8421432!4d-96.8704699!16s%2Fm%2F0kb8n7h!19sChIJAWKcr1OcToYRMFCrgBh13x0?authuser=0&hl=en&rclk=1,motorcycle clubs in dallas tx,dallas tx,dallas,tx
ChIJKzn7zIGhToYR6XBXZZpSQFk,Dallas Eagle Riders,,0,0,http://dallaseagleriders.com/home-clone/,+1 214-327-9563,,Association / Organization,Association / Organization,Open All Days,"8500 Arturo Dr, Dallas, TX 75228, United States",https://www.google.com/maps/place/Dallas+Eagle+Riders/data=!4m7!3m6!1s0x864ea181ccfb392b:0x5940529a655770e9!8m2!3d32.8123137!4d-96.7074541!16s%2Fg%2F11vhf_8x6v!19sChIJKzn7zIGhToYR6XBXZZpSQFk?authuser=0&hl=en&rclk=1,motorcycle clubs in dallas tx,dallas tx,dallas,tx
ChIJ73KgCIa3xokRubhceP1cSyM,Philly Xtreme,,14,4.8,,,https://lh3.ggpht.com/p/AG0ilSypC0KeWHugEyBFSfCJS1dxp7wXEpbOHIS7cKkdCQfss7ef4Ocnm0-o62vgDsUwCVHRQAhCq2MZOc0xOOS2T89T58UPQntRZQHCQrOEHz0hz95LDIIKFHR6donp6mhSiSUuQGQjjU91MSRF=s1024,Restaurant,Restaurant,Open All Days,"Windrim Ave, Philadelphia, PA 19140, United States",https://www.google.com/maps/place/Philly+Xtreme/data=!4m7!3m6!1s0x89c6b78608a072ef:0x234b5cfd785cb8b9!8m2!3d40.0282598!4d-75.1489835!16s%2Fg%2F11h5vz94ld!19sChIJ73KgCIa3xokRubhceP1cSyM?authuser=0&hl=en&rclk=1,motorcycle clubs in philadelphia pa,philadelphia pa,philadelphia,pa
ChIJ_W0AmH1_xokRKHDN1J_kB4A,Reading Motorcycle Club,,226,4.9,http://readingmc.com/,+1 610-987-6422,https://lh3.ggpht.com/p/AG0ilSzadQjxKQzsVzGsh6VZ3vqElf1Q9w6oAs5PKZ1FGx4ATlsavVlUvGVE3oC_xc0vHkB0TVQSZpJ_LmOTcmQF8DbnDUClArdUOPkxZkxVOniOwK_XPyfJHpbZRytWiTBLZvPmZck=s1024,Club,Club,Open All Days,"208 Jefferson St, Oley, PA 19547, United States",https://www.google.com/maps/place/Reading+Motorcycle+Club/data=!4m7!3m6!1s0x89c67f7d98006dfd:0x8007e49fd4cd7028!8m2!3d40.3947558!4d-75.7740022!16s%2Fg%2F1td54csy!19sChIJ_W0AmH1_xokRKHDN1J_kB4A?authuser=0&hl=en&rclk=1,motorcycle clubs in philadelphia pa,philadelphia pa,philadelphia,pa
ChIJ02FcOKOZxokRUERi8T95r7g,The Blue Comet Motorcycle Club,,70,4.8,http://bluecometmc.com/,+1 610-489-1240,https://lh3.ggpht.com/p/AG0ilSy468AB7WNItvwz9ZvULWhT_iLNuSTpvDJDwYZPbRYLQfB7u0mOwna9yDybBgUsDjxC2IM7zGzqLiefd-7to82Wo0t6kGkUjwB7i4g9uMzC-gaxOGtMyWxvcx0EGAkyji5yCegQ=s1024,Club,"Club, Non-profit organization",Open All Days,"4042 Mensch Rd, Schwenksville, PA 19473, United States",https://www.google.com/maps/place/The+Blue+Comet+Motorcycle+Club/data=!4m7!3m6!1s0x89c699a3385c61d3:0xb8af793ff1624450!8m2!3d40.221466!4d-75.4062194!16s%2Fg%2F1tkp5ycf!19sChIJ02FcOKOZxokRUERi8T95r7g?authuser=0&hl=en&rclk=1,motorcycle clubs in philadelphia pa,philadelphia pa,philadelphia,pa
ChIJ___cqZHGxokRywpZB4ZTfAk,State Burners Motorcycle Club,,5,4.6,,+1 443-802-1076,https://streetviewpixels-pa.googleapis.com/v1/thumbnail?panoid=2aRo6bYb4x4D8IAiFjQsHA&cb_client=search.gws-prod.gps&w=408&h=240&yaw=307.3246&pitch=0&thumbfov=100,Motorcycle shop,Motorcycle shop,Open All Days,"5117 Woodland Ave #19, Philadelphia, PA 19143, United States",https://www.google.com/maps/place/State+Burners+Motorcycle+Club/data=!4m7!3m6!1s0x89c6c691a9dcffff:0x97c538607590acb!8m2!3d39.9388164!4d-75.2157982!16s%2Fg%2F11fll6b3nr!19sChIJ___cqZHGxokRywpZB4ZTfAk?authuser=0&hl=en&rclk=1,motorcycle clubs in philadelphia pa,philadelphia pa,philadelphia,pa
ChIJn1RDBCbGxokR7XzEUqApbGA,The Bike Stop,Philadelphia's Leather Bar since 1982,207,4.3,,+1 215-627-1662,https://lh3.ggpht.com/p/AG0ilSwkPH_Wv36jhW-Sl91T5ZWziKKy-t4ordAVr8rJz8Jd0GbUeocPiTI4sCOCrWHJzQMWZToUTSEgFMXLLMKBU9IZdPsCpnpUgZkDxEuNhIeP885FO12ObUcy_uZ1T_WjY8VJ2fvp=s1024,Gay bar,"Gay bar, Night club",Open All Days,"206 Quince St, Philadelphia, PA 19107, United States",https://www.google.com/maps/place/The+Bike+Stop/data=!4m7!3m6!1s0x89c6c6260443549f:0x606c29a052c47ced!8m2!3d39.9483333!4d-75.16!16s%2Fg%2F1tfzhqs5!19sChIJn1RDBCbGxokR7XzEUqApbGA?authuser=0&hl=en&rclk=1,motorcycle clubs in philadelphia pa,philadelphia pa,philadelphia,pa
ChIJOdPKAXQb9YgRtJAG54CLi8U,BLOC BURNAZ MC CLUB HOUSE,,296,4.7,,,https://lh3.ggpht.com/p/AG0ilSwjdYbtg7ONNNC-M6JpyNlW8dDBN2vJBg9Nx-_hp5l7zVh5PsRiQwbXPwwcc4UKmP1fNX5O9BtNX1v13URFCL3dtCSZSINbc4jkxucl3PTjjDc5RFfFmYzqhEdZKwm6GJk1pg9k=s1024,Lounge,Lounge,Open All Days,"905 James Jackson Pkwy NW, Atlanta, GA 30318, United States",https://www.google.com/maps/place/BLOC+BURNAZ+MC+CLUB+HOUSE/data=!4m7!3m6!1s0x88f51b7401cad339:0xc58b8b80e70690b4!8m2!3d33.7793091!4d-84.4752479!16s%2Fg%2F11bw5xmyqq!19sChIJOdPKAXQb9YgRtJAG54CLi8U?authuser=0&hl=en&rclk=1,motorcycle clubs in atlanta ga,atlanta ga,atlanta,ga
ChIJ-djra04B9YgRbrmVGe1UbE4,Vikings Mc Atl,"Vikings Mc ""The Ship 2.0"" Event Hall",86,4.7,,,https://lh3.ggpht.com/p/AG0ilSzRkjtLcIhqiyXdMQRBcqN8zbxdDW-Qr7TsTWkQxmRnRth7XHS_QTNRgzQDgGKiDLPe74wIK86vCTo7sy77CTHCVXoffoe3wEZXDBgWw4k60l1ihkXfHLCkuX6pQaA5B4pPSNOA=s1024,Club,Club,Open All Days,"2179 Verbena St NW, Atlanta, GA 30314, United States",https://www.google.com/maps/place/Vikings+Mc+Atl/data=!4m7!3m6!1s0x88f5014e6bebd8f9:0x4e6c54ed1995b96e!8m2!3d33.7497028!4d-84.3420972!16s%2Fg%2F11ddzl0nv3!19sChIJ-djra04B9YgRbrmVGe1UbE4?authuser=0&hl=en&rclk=1,motorcycle clubs in atlanta ga,atlanta ga,atlanta,ga
ChIJd6Y5vPit9YgR1gmIafkuBZY,Born Losers Motorcycle Club,,206,4.7,https://bornlosersmc.com/,+1 770-484-1975,https://lh3.ggpht.com/p/AG0ilSxfuU4Gi-bk6cwX2bkqX1diOKdzmMfat0srw3_X7r6LXMBadvVc1gEDuMLpnRRq_CpnwdaSvcl3aTlaH12ByCm3zK8NlKyx4XN4xpdQhwRe5FKzPg0vZ7bblQsLhWFWMx6pgciX=s1024,Club,Club,Open All Days,"1810 Rogers Lake Rd, Lithonia, GA 30058, United States",https://www.google.com/maps/place/Born+Losers+Motorcycle+Club/data=!4m7!3m6!1s0x88f5adf8bc39a677:0x96052ef9698809d6!8m2!3d33.7383818!4d-84.1023615!16s%2Fg%2F1tf613wk!19sChIJd6Y5vPit9YgR1gmIafkuBZY?authuser=0&hl=en&rclk=1,motorcycle clubs in atlanta ga,atlanta ga,atlanta,ga
ChIJLfuV9ksC9YgR3KICBAAMxnc,Naptown Clubhouse,,13,4.8,,,https://lh3.ggpht.com/p/AG0ilSwrLxJd8QdSWdmLkai9sFhBpITRtiOo3lwkG6LNsSyFxwD2FDh5VpU3zFt10HAXiNkxOukDfAWaDUoxiaHnEhorv6BDo-eTCq7xRAr5wk0G0ptILH-KvVkzvhsyTlrb4LO15BVs0g=s1024,Sports club,Sports club,Open All Days,"1657 Lakewood Ave SE, Atlanta, GA 30315, United States",https://www.google.com/maps/place/Naptown+Clubhouse/data=!4m7!3m6!1s0x88f5024bf695fb2d:0x77c60c000402a2dc!8m2!3d33.7089677!4d-84.3803152!16s%2Fg%2F11f04dfyh4!19sChIJLfuV9ksC9YgR3KICBAAMxnc?authuser=0&hl=en&rclk=1,motorcycle clubs in atlanta ga,atlanta ga,atlanta,ga
ChIJayJeE4pV9IgRNYpBXyO7PhA,N The Zone MC,,41,4.9,https://www.facebook.com/groups/98373942053,,https://lh3.ggpht.com/p/AG0ilSzjLwgy4zvSSiKQn-BBFCmZ3dp7cc-K0O1DbOQSMZFTXeIWqKfYD8ebGUmVY9wqQApJfA-AS6Hjrj4aBwhFw0m80BkqNzAWxgr3dJ8-Wn_18tkcmQnReKjo6SKKvmxnVaYk2EoDNg=s1024,Bar,Bar,Open All Days,"024-01015000, 406 County Line Rd, Ellenwood, GA 30294, United States",https://www.google.com/maps/place/N+The+Zone+MC/data=!4m7!3m6!1s0x88f4558a135e226b:0x103ebb235f418a35!8m2!3d33.6467021!4d-84.2504284!16s%2Fg%2F11f6500y33!19sChIJayJeE4pV9IgRNYpBXyO7PhA?authuser=0&hl=en&rclk=1,motorcycle clubs in atlanta ga,atlanta ga,atlanta,ga
